{
  "schema": "https://example.invalid/sw-dev-team-template/handoff.schema.json",
  "task_id": "v1.1-framework-scope-maintenance",
  "status": "active",
  "mode": {
    "execution": "bounded-codex",
    "codex_allowed": true,
    "codex_server": "codex"
  },
  "owner_role": "software-engineer",
  "review_roles": ["code-reviewer"],
  "security_roles": [],
  "objective": "Exercise framework-scope gate with framework-maintenance scope.",
  "allowed_paths": ["**"],
  "forbidden_paths": [],
  "framework_scope": "framework-maintenance",
  "requires": {
    "tests": [],
    "review": false,
    "security_review": false,
    "human_approval": false
  },
  "acceptance_criteria": [
    "Framework-managed writes are allowed when framework_scope is framework-maintenance."
  ],
  "hard_rule_traces": [],
  "activity": [],
  "verification": {
    "tests": [],
    "reviews": [],
    "security": [],
    "human_approval": []
  },
  "completion": {
    "claimed_by": null,
    "completed_at": null,
    "evidence": []
  }
}
