{
  "schema": "https://example.invalid/sw-dev-team-template/handoff.schema.json",
  "task_id": "v1.1-tool-activity-only-deny-001",
  "status": "active",
  "mode": {
    "execution": "claude-code",
    "codex_allowed": false,
    "codex_server": "none"
  },
  "owner_role": "software-engineer",
  "review_roles": ["code-reviewer"],
  "security_roles": [],
  "objective": "Fixture: external_tool_activity (llmdc + speckit) present but NO accepted review/test evidence — completion gate must deny.",
  "allowed_paths": ["tests/**", "scripts/**"],
  "forbidden_paths": ["CUSTOMER_NOTES.md"],
  "framework_scope": "framework-maintenance",
  "requires": {
    "tests": ["tests/hooks/test-handoff-task-completed-gate.sh"],
    "review": true,
    "security_review": false,
    "human_approval": false
  },
  "acceptance_criteria": [
    "Completion is denied when only external_tool_activity references exist and required test/review evidence is absent."
  ],
  "hard_rule_traces": [
    {
      "rule_id": "FR-018",
      "description": "External-tool output (llmdc, Speckit) is input-only; it does not constitute accepted evidence and cannot satisfy final evidence gates.",
      "source": "specs/012-v1-1-handoff-contracts/data-model.md llmdc Activity + Speckit Artifact; FR-018..FR-023; SC-007"
    }
  ],
  "external_tool_activity": [
    {
      "tool_type": "llmdc",
      "activity_type": "planning",
      "affected_artifact": "docs/handoffs/T032-tool-activity-gate.json",
      "canonical_role_owner": "software-engineer",
      "cited_active_handoff": "v1.1-tool-activity-only-deny-001",
      "limitations": "Cannot approve evidence gates or record customer truth independently."
    },
    {
      "tool_type": "speckit",
      "activity_type": "checklist",
      "affected_artifact": "specs/012-v1-1-handoff-contracts/tasks.md",
      "canonical_role_owner": "software-engineer",
      "cited_active_handoff": "v1.1-tool-activity-only-deny-001",
      "limitations": "Analysis and checklist output is input only until accepted through the owning role and handoff evidence gates.",
      "speckit_artifact_type": "acceptance-checklist",
      "speckit_feature_path": "US4/T032",
      "speckit_source_authority": "input-only"
    }
  ],
  "activity": [],
  "verification": {
    "tests": [],
    "reviews": [],
    "security": [],
    "human_approval": []
  },
  "completion": {
    "claimed_by": null,
    "completed_at": null,
    "evidence": []
  }
}
