{
  "schema": "https://example.invalid/sw-dev-team-template/handoff.schema.json",
  "task_id": "v1.1-handoff-contracts-red-001",
  "status": "active",
  "mode": {
    "execution": "bounded-codex",
    "codex_allowed": true,
    "codex_server": "codex"
  },
  "owner_role": "software-engineer",
  "review_roles": ["code-reviewer"],
  "security_roles": [],
  "objective": "Implement the first handoff contract validation slice.",
  "allowed_paths": [
    "schemas/handoff.schema.json",
    "scripts/validate-handoff.py",
    "scripts/hooks/lib/path_scope.py"
  ],
  "forbidden_paths": [".claude/**", "CUSTOMER_NOTES.md"],
  "framework_scope": "framework-maintenance",
  "requires": {
    "tests": ["tests/hooks/test-handoff-contracts.sh"],
    "review": true,
    "security_review": false,
    "human_approval": false
  },
  "acceptance_criteria": [
    "Required handoff fields are validated.",
    "Forbidden paths override allowed paths."
  ],
  "hard_rule_traces": [],
  "activity": [],
  "verification": {
    "tests": [],
    "reviews": [],
    "security": [],
    "human_approval": []
  },
  "completion": {
    "claimed_by": null,
    "completed_at": null,
    "evidence": []
  }
}
