{
  "schema": "https://example.invalid/sw-dev-team-template/handoff.schema.json",
  "task_id": "v1.1-completion-evidence-gate",
  "status": "active",
  "mode": {
    "execution": "bounded-codex",
    "codex_allowed": true,
    "codex_server": "codex"
  },
  "owner_role": "software-engineer",
  "review_roles": ["code-reviewer"],
  "security_roles": [],
  "objective": "Implement completion evidence gate behavior.",
  "allowed_paths": ["scripts/hooks/handoff-task-completed-gate.py"],
  "forbidden_paths": ["CUSTOMER_NOTES.md"],
  "framework_scope": "framework-maintenance",
  "requires": {
    "tests": ["tests/hooks/test-handoff-task-completed-gate.sh"],
    "review": true,
    "security_review": false,
    "human_approval": false
  },
  "acceptance_criteria": [
    "Self-attested completion evidence does not satisfy independent evidence gates."
  ],
  "hard_rule_traces": [],
  "activity": [],
  "verification": {
    "tests": [],
    "reviews": [],
    "security": [],
    "human_approval": []
  },
  "completion": {
    "claimed_by": "software-engineer",
    "completed_at": "2026-05-26T00:00:00Z",
    "evidence": [
      {
        "type": "test",
        "name": "tests/hooks/test-handoff-task-completed-gate.sh",
        "result": "passed",
        "actor_role": "software-engineer"
      },
      {
        "type": "review",
        "artifact": "docs/reviews/self-review.md",
        "result": "approved",
        "actor_role": "software-engineer"
      }
    ]
  }
}
